{
  "formatVersion": 1,
  "status": "calibration-only",
  "sourceSectionSha256": "de22308d19e357db0dd77e35a7be712960c39e3cd15f3caaa28e86769b212000",
  "requirements": [
    {
      "id": "CAL-FALLBACK-001",
      "statement": "The pre-resolution candidate sequence is a first-wins ordered union.",
      "registrationBefore": ["M3a"],
      "owner": "M7",
      "parityClass": "portable",
      "evidenceKinds": ["vector", "compatibility-run"],
      "sourceAnchor": "2.2:L108"
    },
    {
      "id": "CAL-FALLBACK-002",
      "statement": "Tier 1 of the pre-resolution sequence is `fallbackLocalesFor(lookupLocale)`, preserving its output order.",
      "registrationBefore": ["M3a"],
      "owner": "M7",
      "parityClass": "portable",
      "evidenceKinds": ["vector", "compatibility-run"],
      "sourceAnchor": "2.2:L110-L114"
    },
    {
      "id": "CAL-FALLBACK-003",
      "statement": "`fallbackLocalesFor` forms an ordered union of raw-tag traversal, CLDR-canonical-tag traversal, then canonical-parent closure.",
      "registrationBefore": ["M3b"],
      "owner": "M7",
      "parityClass": "portable",
      "evidenceKinds": ["generated-partition", "compatibility-run"],
      "sourceAnchor": "2.2:L110-L112"
    },
    {
      "id": "CAL-FALLBACK-004",
      "statement": "Every fallback traversal inserts its current tag.",
      "registrationBefore": ["M3a"],
      "owner": "M7",
      "parityClass": "portable",
      "evidenceKinds": ["vector", "compatibility-run"],
      "sourceAnchor": "2.2:L111-L112"
    },
    {
      "id": "CAL-FALLBACK-005",
      "statement": "Every fallback traversal inserts applicable explicit CLDR parents.",
      "registrationBefore": ["M3b"],
      "owner": "M7",
      "parityClass": "portable",
      "evidenceKinds": ["generated-partition", "compatibility-run"],
      "sourceAnchor": "2.2:L112"
    },
    {
      "id": "CAL-FALLBACK-006",
      "statement": "Fallback traversal truncates exactly one subtag per truncation step.",
      "registrationBefore": ["M3a"],
      "owner": "M7",
      "parityClass": "portable",
      "evidenceKinds": ["vector", "compatibility-run"],
      "sourceAnchor": "2.2:L112-L113"
    },
    {
      "id": "CAL-FALLBACK-007",
      "statement": "Fallback truncation terminates when a parent reaches `root`.",
      "registrationBefore": ["M3b"],
      "owner": "M7",
      "parityClass": "portable",
      "evidenceKinds": ["vector", "compatibility-run"],
      "sourceAnchor": "2.2:L112-L113"
    },
    {
      "id": "CAL-FALLBACK-008",
      "statement": "Fallback truncation stops before crossing a likely-script boundary.",
      "registrationBefore": ["M3b"],
      "owner": "M7",
      "parityClass": "portable",
      "evidenceKinds": ["generated-partition", "compatibility-run"],
      "sourceAnchor": "2.2:L113"
    },
    {
      "id": "CAL-FALLBACK-009",
      "statement": "Each fallback traversal finally applies the `no` ↔ `nb` bridge.",
      "registrationBefore": ["M3b"],
      "owner": "M7",
      "parityClass": "portable",
      "evidenceKinds": ["vector", "compatibility-run"],
      "sourceAnchor": "2.2:L113-L114"
    },
    {
      "id": "CAL-FALLBACK-010",
      "statement": "The bridged `no`/`nb` locale is processed by the same fallback-traversal algorithm.",
      "registrationBefore": ["M3b"],
      "owner": "M7",
      "parityClass": "portable",
      "evidenceKinds": ["vector", "compatibility-run"],
      "sourceAnchor": "2.2:L113-L114"
    },
    {
      "id": "CAL-FALLBACK-011",
      "statement": "The `no` ↔ `nb` bridge must not recursively invoke the bridge again.",
      "registrationBefore": ["M3b"],
      "owner": "M7",
      "parityClass": "portable",
      "evidenceKinds": ["vector", "compatibility-run"],
      "sourceAnchor": "2.2:L114"
    },
    {
      "id": "CAL-FALLBACK-012",
      "statement": "Tier 2 contributes at most one supported likely-language/script match.",
      "registrationBefore": ["M3b"],
      "owner": "M7",
      "parityClass": "portable",
      "evidenceKinds": ["generated-partition", "compatibility-run"],
      "sourceAnchor": "2.2:L115"
    },
    {
      "id": "CAL-FALLBACK-013",
      "statement": "Tier 3 contributes script-compatible supported locales in normalized-primary-language tiebreaker order.",
      "registrationBefore": ["M3b"],
      "owner": "M7",
      "parityClass": "portable",
      "evidenceKinds": ["vector", "compatibility-run"],
      "sourceAnchor": "2.2:L116"
    },
    {
      "id": "CAL-FALLBACK-014",
      "statement": "Tier 4 contributes the resolved exact fallback-locale file.",
      "registrationBefore": ["M3a"],
      "owner": "M7",
      "parityClass": "portable",
      "evidenceKinds": ["vector", "compatibility-run"],
      "sourceAnchor": "2.2:L117"
    },
    {
      "id": "CAL-FALLBACK-016",
      "statement": "Candidate resolution first selects an exact normalized loaded tag when one exists.",
      "registrationBefore": ["M3a"],
      "owner": "M7",
      "parityClass": "portable",
      "evidenceKinds": ["vector", "compatibility-run"],
      "sourceAnchor": "2.2:L119"
    },
    {
      "id": "CAL-FALLBACK-017",
      "statement": "Without an exact normalized loaded tag, candidate resolution selects the sole CLDR-equivalent loaded tag when exactly one exists.",
      "registrationBefore": ["M3b"],
      "owner": "M7",
      "parityClass": "portable",
      "evidenceKinds": ["vector", "compatibility-run"],
      "sourceAnchor": "2.2:L119-L120"
    },
    {
      "id": "CAL-FALLBACK-018",
      "statement": "If prior resolution alternatives fail, candidate resolution selects the first equivalent tag in the applicable tiebreaker list.",
      "registrationBefore": ["M3b"],
      "owner": "M7",
      "parityClass": "portable",
      "evidenceKinds": ["vector", "compatibility-run"],
      "sourceAnchor": "2.2:L120"
    },
    {
      "id": "CAL-FALLBACK-019",
      "statement": "If prior resolution alternatives fail, candidate resolution selects the resolved fallback tag when it is among the equivalent tags.",
      "registrationBefore": ["M3b"],
      "owner": "M7",
      "parityClass": "portable",
      "evidenceKinds": ["vector", "compatibility-run"],
      "sourceAnchor": "2.2:L120-L121"
    },
    {
      "id": "CAL-FALLBACK-020",
      "statement": "If all earlier resolution alternatives fail, candidate resolution selects the lexicographically first equivalent normalized loaded tag.",
      "registrationBefore": ["M3b"],
      "owner": "M7",
      "parityClass": "portable",
      "evidenceKinds": ["vector", "compatibility-run"],
      "sourceAnchor": "2.2:L121-L122"
    },
    {
      "id": "CAL-FALLBACK-021",
      "statement": "A candidate for which no loaded file resolves remains catalog-less.",
      "registrationBefore": ["M3a"],
      "owner": "M7",
      "parityClass": "portable",
      "evidenceKinds": ["vector", "compatibility-run"],
      "sourceAnchor": "2.2:L122"
    },
    {
      "id": "CAL-FALLBACK-022",
      "statement": "When a file resolves, `attemptedLocale` is that file's exact normalized tag.",
      "registrationBefore": ["M3a"],
      "owner": "M7",
      "parityClass": "portable",
      "evidenceKinds": ["vector", "compatibility-run"],
      "sourceAnchor": "2.2:L125-L126"
    },
    {
      "id": "CAL-FALLBACK-023",
      "statement": "When no file resolves, `attemptedLocale` is the candidate's normalized tag.",
      "registrationBefore": ["M3a"],
      "owner": "M7",
      "parityClass": "portable",
      "evidenceKinds": ["vector", "compatibility-run"],
      "sourceAnchor": "2.2:L125-L126"
    },
    {
      "id": "CAL-FALLBACK-024",
      "statement": "Candidate deduplication is first-wins on the post-resolution exact attempted-locale tag.",
      "registrationBefore": ["M3a"],
      "owner": "M7",
      "parityClass": "portable",
      "evidenceKinds": ["vector", "compatibility-run"],
      "sourceAnchor": "2.2:L126"
    },
    {
      "id": "CAL-FALLBACK-026",
      "statement": "`attemptedLocales` contains only candidates that resolution actually entered.",
      "registrationBefore": ["M3a"],
      "owner": "M7",
      "parityClass": "portable",
      "evidenceKinds": ["vector", "compatibility-run"],
      "sourceAnchor": "2.2:L128-L129"
    },
    {
      "id": "CAL-FALLBACK-027",
      "statement": "`attemptedLocales` includes the candidate that succeeds.",
      "registrationBefore": ["M3a"],
      "owner": "M7",
      "parityClass": "portable",
      "evidenceKinds": ["vector", "compatibility-run"],
      "sourceAnchor": "2.2:L128-L129"
    },
    {
      "id": "CAL-FALLBACK-028",
      "statement": "A fallback-policy result of `false` truncates `attemptedLocales` at that point.",
      "registrationBefore": ["M3b"],
      "owner": "M7",
      "parityClass": "portable",
      "evidenceKinds": ["vector", "compatibility-run"],
      "sourceAnchor": "2.2:L129"
    },
    {
      "id": "CAL-FALLBACK-029",
      "statement": "The fallback policy is invoked only when another distinct post-resolution candidate exists and is never invoked after the last candidate.",
      "registrationBefore": ["M3b"],
      "owner": "M7",
      "parityClass": "portable",
      "evidenceKinds": ["vector", "compatibility-run"],
      "sourceAnchor": "2.2:L129-L130"
    },
    {
      "id": "CAL-FALLBACK-030",
      "statement": "Normalized primary language is obtained by CLDR-canonicalizing the complete tag before extracting its primary language.",
      "registrationBefore": ["M3b"],
      "owner": "M7",
      "parityClass": "portable",
      "evidenceKinds": ["generated-partition", "compatibility-run"],
      "sourceAnchor": "2.2:L132-L133"
    },
    {
      "id": "CAL-FALLBACK-031",
      "statement": "A private-use tag has no normalized primary language.",
      "registrationBefore": ["M3b"],
      "owner": "M7",
      "parityClass": "portable",
      "evidenceKinds": ["vector", "compatibility-run"],
      "sourceAnchor": "2.2:L133"
    },
    {